{
  "$schema": "http://json-schema.org/draft-07/schema#",
  "$id": "boenmind:mcp:mcp-server:v0.1",
  "x-frozen": "2026-08-30",
  "title": "MCP Server 接入配置 v0.1",
  "description": "M7.2/M7.7:单个 MCP server 的安装声明。配置文件显式列出即视为用户安装批准(M7 规格 S6);env/bearer_token 一律 secret: 引用,明文不入配置(基线 4.6)。远程 MCP(SSE/HTTP) 传输层与访问令牌支持(Minor)。 sha256 为可选完整性校验字段(Minor 2026-09-03)。",
  "type": "object",
  "required": [
    "name",
    "transport"
  ],
  "additionalProperties": false,
  "properties": {
    "name": {
      "type": "string",
      "pattern": "^[a-z][a-z0-9_]{0,31}$",
      "description": "server 名,参与能力命名空间 mcp.<name>.<tool>;字符集与能力名段一致"
    },
    "transport": {
      "enum": [
        "stdio",
        "sse",
        "http",
        "streamable-http"
      ]
    },
    "url": {
      "type": "string",
      "description": "远程 MCP 服务 URL(SSE 或 Streamable HTTP 端点)"
    },
    "bearer_token": {
      "type": "string",
      "pattern": "^secret:[A-Za-z0-9_.-]{1,64}$",
      "description": "远程 MCP 访问令牌,值必须是 Secret Store 引用"
    },
    "command": {
      "type": "string",
      "minLength": 1
    },
    "args": {
      "type": "array",
      "items": {
        "type": "string"
      },
      "maxItems": 32
    },
    "env": {
      "type": "object",
      "additionalProperties": {
        "type": "string",
        "pattern": "^secret:[A-Za-z0-9_.-]{1,64}$"
      },
      "description": "注入子进程的环境变量,值必须是 Secret Store 引用"
    },
    "tool_timeout_ms": {
      "type": "integer",
      "minimum": 100,
      "maximum": 600000
    },
    "restart_limit": {
      "type": "integer",
      "minimum": 0,
      "maximum": 10
    },
    "trust": {
      "enum": [
        "explicit-config"
      ],
      "description": "M7 仅接受显式配置安装;运行期动态注册随 Wire 面增发(M8)"
    },
    "payload": {
      "type": "string",
      "minLength": 1,
      "description": "完整性校验的目标文件(ADR-0035,Minor 2026-09-11)。解释器型条目(command=python + args=[脚本])须以此声明真实载荷;存在 payload 时 sha256 一律哈希 payload。管理面托管条目恒写候选文件路径。"
    },
    "sha256": {
      "type": "string",
      "pattern": "^[0-9a-f]{64}$",
      "description": "完整性校验目标的 SHA-256(十六进制)。目标 = payload(若声明)否则 command;解释器型条目必须声明 payload,否则装载期 fail-closed 拒载(ADR-0035)。批准接入时记录,装载/重载时复验,不符拒载(2026-09-03 Minor:外部评审完整性校验)"
    }
  }
}