[
  {
    "name": "wiki",
    "transport": "stdio",
    "command": "python",
    "args": ["apps/wiki_server.py", "--dir", "<wiki 数据目录>"],
    "payload": "apps/wiki_server.py",
    "trust": "explicit-config",
    "tool_timeout_ms": 30000,
    "restart_limit": 3
  },
  {
    "name": "market",
    "transport": "stdio",
    "command": "python",
    "args": ["apps/market_server.py"],
    "payload": "apps/market_server.py",
    "trust": "explicit-config",
    "tool_timeout_ms": 15000,
    "restart_limit": 3
  },
  {
    "name": "music",
    "transport": "stdio",
    "command": "python",
    "args": ["apps/music_server.py", "--dir", "<音乐文件目录>"],
    "payload": "apps/music_server.py",
    "trust": "explicit-config",
    "tool_timeout_ms": 15000,
    "restart_limit": 3
  },
  {
    "name": "web_multisearch",
    "transport": "stdio",
    "command": "plugins\\mcp\\web-multisearch\\target\\release\\web-multisearch.exe",
    "args": [
      "--config",
      "<数据目录>\\config\\mcp-web_multisearch.json"
    ],
    "trust": "explicit-config",
    "tool_timeout_ms": 30000,
    "restart_limit": 3
  }
]
